"","Kingdom","Phylum","Class","Order","Family","Genus","Genus.y","Species","Sequence","oldGroups","tag","oldname2"
"Lachnospiraceae","Bacteria","Firmicutes","Clostridia","Clostridiales","Lachnospiraceae",NA,NA,NA,NA,"Coprococcus, Lachnospiraceae.14, Lachnospiraceae.15, Lachnospiraceae.16, Clostridium_XlVb","Lachnospiraceae","Coprococcus"
"Howardella","Bacteria","Firmicutes","Clostridia","Clostridiales","Lachnospiraceae","Howardella",NA,NA,NA,"Howardella ureilytica, Howardella","Howardella","Howardella"
"Clostridiales","Bacteria","Firmicutes","Clostridia","Clostridiales",NA,NA,NA,NA,NA,"Lachnospiraceae.5, Clostridium_XlVa, Clostridium_XlVa aldenense, Lachnospiraceae.6, Lachnospiraceae.7, Lachnospiraceae.8, Lachnospiraceae.9, Lachnospiraceae.10, Lachnospiraceae.11, Lachnospiraceae.12, Lachnospiraceae.13, Anaerostipes hadrus, Anaerostipes, Lachnospiraceae.17, Lachnospiraceae.18, Lachnospiraceae.19, Coprococcus catus, Lachnospiraceae.20, Lachnospiraceae.21, Lachnospiraceae.22, Lachnospiraceae.23, Dorea longicatena, Dorea, Clostridium_XlVa scindens, Lachnospiraceae.24, Lachnospiraceae.25, Eisenbergiella tayi, Lachnospiraceae.26, Lachnospiraceae.27, Roseburia hominis, Roseburia intestinalis, Roseburia, Roseburia faecis, Roseburia inulinivorans, Lachnospiraceae.28, Lachnospiraceae.29, Lachnospiraceae.30, Lachnospiraceae.31, Lachnospiraceae.32, Lachnospiraceae.33, Lachnospiraceae.34, Clostridium_XlVb lactatifermentans, Clostridium_XlVb.1, Clostridiales.27, Clostridium_XlVb.2, Clostridiales.28, Clostridium_XlVb.3, Clostridium_XlVa.1","Clostridiales","Roseburia"
"Pasteurellaceae","Bacteria","Proteobacteria","Gammaproteobacteria","Pasteurellales","Pasteurellaceae",NA,NA,NA,NA,"Haemophilus parainfluenzae, Aggregatibacter segnis","Pasteurellaceae","Haemophilus parainfluenzae"
"Succinivibrio","Bacteria","Proteobacteria","Gammaproteobacteria","Aeromonadales","Succinivibrionaceae","Succinivibrio",NA,NA,"CCTGTTTGCTACCCACGCTTTCGCATATGAGCGTCAGTATTTGCCCAGGAGACTGCCTTCGCCTTTGGTGTTCTTCCAGATATCTACGCATTCCACCGCTACACCTGGAATTCCGTCTCCCCCTGCAATACTCTAGTCCACCAGTTTAGTATGCTGTTCCCAGGTTGAGCCCGGGGATTTCACATCCTACTTGATGAACCGCCTGCATGCCCTTTACGCCCAGTTATTCCGATTAACGCTTGCACCCTCCGTATTACCGCGGCTGCTGGCACGGAGTT","Succinivibrio","Succinivibrio","Succinivibrio"
"Enterobacteriaceae","Bacteria","Proteobacteria","Gammaproteobacteria","Enterobacteriales","Enterobacteriaceae",NA,NA,NA,NA,"Enterobacteriaceae, Escrichia coli et al., Escherichia/Shigella, Hafnia alvei","Enterobacteriaceae","Escrichia coli et al."
"Pseudomonas deceptionensis/flu et al.","Bacteria","Proteobacteria","Gammaproteobacteria","Pseudomonadales","Pseudomonadaceae","Pseudomonas","Pseudomonas","deceptionensis/fluorescens/fragi/lundensis/psychrophila/putida/syringae/taiwanensis","CCTGTTTGCTCCCCACGCTTTCGCACCTCAGTGTCAGTATCAGTCCAGGTAGTCGCCTTCGCCACTGGTGTTCCTTCCTATATCTACGCATTTCACCGCTACACAGGAAATTCCACTACCCTCTACCATACTCTAGCTTGCCAGTTTTGGATGCAGTTCCCAGGTTGAGCCCGGGGATTTCACATTCAACTTAACAAACCACCTACGCGCGCTTTACGCCCAGTAATTCCGATTAACGCTTGCACCCTCTGTATTACCGCGGCTGCTGGCACAGAGTT","Pseudomonas deceptionensis/flu et al.","Pseudomonas deceptionensis/flu et al.","Pseudomonas deceptionensis/flu et al."
"Desulfovibrionales","Bacteria","Proteobacteria","Deltaproteobacteria","Desulfovibrionales",NA,NA,NA,NA,NA,"Desulfovibrionales, Desulfovibrio, Bilophila, Bilophila.1, Bilophila wadsworthia","Desulfovibrionales","Bilophila wadsworthia"
"Betaproteobacteria","Bacteria","Proteobacteria","Betaproteobacteria",NA,NA,NA,NA,NA,NA,"Betaproteobacteria, Sutterella, Sutterella stercoricanis, Sutterella wadsworthensis, Sutterella.1, Sutterella wadsworthensis.1, Parasutterella excrementihominis","Betaproteobacteria","Sutterella wadsworthensis"
"Campylobacter","Bacteria","Proteobacteria","Epsilonproteobacteria","Campylobacterales","Campylobacteraceae","Campylobacter",NA,NA,NA,"Campylobacter hominis, Campylobacter, Campylobacter ureolyticus","Campylobacter","Campylobacter hominis"
"Porphyromonadaceae","Bacteria","Bacteroidetes","Bacteroidia","Bacteroidales","Porphyromonadaceae",NA,NA,NA,"CCTGTTCGATACCCACGCTTTCGTGCCTCAGCGTCAGTCATGCACTGGAAGGCTGCCTTCGCAATCGGAGTTCTGCGCAATATCTATGCATTTCACCGCTACACCGCGCATTCCGCCTTCCTCGCGCACACTCCAGCACACCAGTTTCAACGGCTAAACGGGGTTGAGCCCCGAGATTTTACCGCTGACTTGATGCACAGCCTGCGCACCCTTTAAACCCAATAAATCCGGATAACGCTCGCATCCTCCGTATTACCGCGGCTGCTGGCACGGAGTTA","Porphyromonadaceae","Porphyromonadaceae","Porphyromonadaceae"
"Porphyromonadaceae.1","Bacteria","Bacteroidetes","Bacteroidia","Bacteroidales","Porphyromonadaceae",NA,NA,NA,NA,"Barnesiella, Barnesiella.1, Barnesiella.2, Barnesiella.3, Barnesiella.4, Porphyromonadaceae.1","Porphyromonadaceae.1","Barnesiella.2"
"Coprobacter","Bacteria","Bacteroidetes","Bacteroidia","Bacteroidales","Porphyromonadaceae","Coprobacter",NA,NA,NA,"Coprobacter fastidiosus, Coprobacter","Coprobacter","Coprobacter"
"Bacteroidetes","Bacteria","Bacteroidetes",NA,NA,NA,NA,NA,NA,"CCTGTTCGCTCCCCACGCTTTCGTGCCTCAGCGTCAATCCCGGCCTGGCCAGCTGCCTCCGCAATCGGCCTTCCACGTGATCTCTATGCATTTCACCGCTACACCACGCGTTCCGCCAGCCTCGACCGTATCCAAGCGGGGCGGTTTCCACGGCCAGGCCGGGGTTGAGCCCCGGCGTTTCACCGCGGACGGACCCCGCCGCCTGCGCACCCTTTAAACCCAGTAAATCCGGATAACGCTCGGATCCCCCGTATTACCGCGGCTGCTGGCACGGAGTT","Bacteroidetes","Bacteroidetes","Bacteroidetes"
"Odoribacter splanchnicus","Bacteria","Bacteroidetes","Bacteroidia","Bacteroidales","Porphyromonadaceae","Odoribacter","Odoribacter","splanchnicus",NA,"Odoribacter splanchnicus, Odoribacter splanchnicus.1","Odoribacter splanchnicus","Odoribacter splanchnicus"
"Butyricimonas","Bacteria","Bacteroidetes","Bacteroidia","Bacteroidales","Porphyromonadaceae","Butyricimonas",NA,NA,NA,"Butyricimonas, Butyricimonas.1, Butyricimonas paravirosa, Butyricimonas faecihominis, Butyricimonas.2, Butyricimonas.3","Butyricimonas","Butyricimonas faecihominis"
"Bacteroidetes.1","Bacteria","Bacteroidetes",NA,NA,NA,NA,NA,NA,NA,"Alistipes massiliensis, Alistipes finegoldii/onderdonkii, Alistipes finegoldii, Alistipes shahii, Alistipes obesi, Alistipes putredinis, Alistipes inops","Bacteroidetes.1","Alistipes putredinis"
"Alistipes","Bacteria","Bacteroidetes","Bacteroidia","Bacteroidales","Rikenellaceae","Alistipes",NA,NA,NA,"Alistipes marseilloanorexicus, Alistipes indistinctus, Alistipes","Alistipes","Alistipes marseilloanorexicus"
"Bacteroidales","Bacteria","Bacteroidetes","Bacteroidia","Bacteroidales",NA,NA,NA,NA,"CCTGTTCGATACCCGCGCTTTCGTGCCTCAGCGTCAATTACGGCCTCGTGGGATGCCTTCGCAATCGGTGTTCTGTGTGATATCTATGCATTTCACCGCTACACCACACATTCCTCCCACGTCGATCGTATTCCAGCCTCTCAGTTTCAACGGCACATCCCTCGTTGAGCGAGGGCATTTCACCGCTGACTTGAAATGCCGCCTACGCACCCTTTAAACCCAATAAATCCGGATAACGCTCGCATCCTCCGTATTACCGCGGCTGCTGGCACGGAGTT","Bacteroidales","Bacteroidales","Bacteroidales"
"Porphyromonas","Bacteria","Bacteroidetes","Bacteroidia","Bacteroidales","Porphyromonadaceae","Porphyromonas",NA,NA,NA,"Porphyromonas, Porphyromonas.1, Porphyromonas.2, Porphyromonas bennonis, Porphyromonas.3, Porphyromonas.4, Porphyromonas.5, Porphyromonas somerae","Porphyromonas","Porphyromonas.4"
"Porphyromonas.1","Bacteria","Bacteroidetes","Bacteroidia","Bacteroidales","Porphyromonadaceae","Porphyromonas",NA,NA,NA,"Porphyromonas.6, Porphyromonas.7","Porphyromonas.1","Porphyromonas.6"
"Porphyromonas.2","Bacteria","Bacteroidetes","Bacteroidia","Bacteroidales","Porphyromonadaceae","Porphyromonas",NA,NA,NA,"Porphyromonas.8, Porphyromonas uenonis, Porphyromonas uenonis.1, Porphyromonas asaccharolytica","Porphyromonas.2","Porphyromonas asaccharolytica"
"Porphyromonadaceae.2","Bacteria","Bacteroidetes","Bacteroidia","Bacteroidales","Porphyromonadaceae",NA,NA,NA,"CCTGTTTGATCCCCACGCTGTCGTGCCTAAGTGTCAGATAAAGCCTGGTAAGCTGCCTTCGCAATCGGAGTTCTGTGTGATATCTATGCATTTCACCGCTACACCACACATTCCGCCTACCTCGTCTCCTCTCTAGCTATACGGTTTCAATGGCAAGACCATGGTTGAGCCATAGCTTTTCACCACTGACCTGATTAGCCACCTGCGCACCCTTTAAACCCAATAATTCCGGATAACGCTCGCATCCCCCGTATTACCGCGGCTGCTGGCACGGAGTT","Porphyromonadaceae.2","Porphyromonadaceae.2","Porphyromonadaceae.2"
"Parabacteroides","Bacteria","Bacteroidetes","Bacteroidia","Bacteroidales","Porphyromonadaceae","Parabacteroides",NA,NA,NA,"Parabacteroides, Parabacteroides merdae, Parabacteroides goldsteinii, Parabacteroides distasonis, Parabacteroides.1, Parabacteroides distasonis.1, Parabacteroides distasonis.2, Parabacteroides distasonis.3","Parabacteroides","Parabacteroides merdae"
"Prevotella","Bacteria","Bacteroidetes","Bacteroidia","Bacteroidales","Prevotellaceae","Prevotella",NA,NA,NA,"Prevotella, Prevotella.1, Prevotella.2, Prevotella copri, Prevotella.3, Prevotella.4, Prevotella.5","Prevotella","Prevotella copri"
"Prevotella bergensis","Bacteria","Bacteroidetes","Bacteroidia","Bacteroidales","Prevotellaceae","Prevotella","Prevotella","bergensis",NA,"Prevotella bergensis, Prevotella bergensis.1","Prevotella bergensis","Prevotella bergensis"
"Prevotella.1","Bacteria","Bacteroidetes","Bacteroidia","Bacteroidales","Prevotellaceae","Prevotella",NA,NA,NA,"Prevotella disiens, Prevotella.6, Prevotella corporis, Prevotella corporis.1, Prevotella.7, Prevotella bivia, Prevotella.8, Prevotella bivia.1","Prevotella.1","Prevotella disiens"
"Prevotella.2","Bacteria","Bacteroidetes","Bacteroidia","Bacteroidales","Prevotellaceae","Prevotella",NA,NA,NA,"Prevotella.9, Prevotella.10, Prevotella.11, Prevotella timonensis, Prevotella.12, Prevotella.13, Prevotella buccalis, Prevotella.14, Prevotella buccalis.1","Prevotella.2","Prevotella timonensis"
"Bacteroidetes.2","Bacteria","Bacteroidetes",NA,NA,NA,NA,NA,NA,"CCTGTTCGATACCCGCACCTTCGAGCCTCAACGTCAGTAGGGACGCGGCACGCTGCCTTCGCAATCGGGGTTCCTCGTGATATCTGAGCATTTCACCGCTACACCACGAATTCCGCGTGCCTCCAGCCCACTCAAGCCCGCCAGTTCGCGCAGCAGGGCCGCGGTTGGGCCGCGGCGTTTCACTGCACGCTTGACAGGCAGTCTGCGCTCCCTTTAAACCCAATAAATCCGGATAACACCCGGACCTTCCGTATTACCGCGGCTGCTGGCACGGAATT","Bacteroidetes.1","Bacteroidetes.2","Bacteroidetes.1"
"Prevotella.3","Bacteria","Bacteroidetes","Bacteroidia","Bacteroidales","Prevotellaceae","Prevotella",NA,NA,"CCTGTTTGATACCCACACTTTCGAGCCTCAATGTCAGTTGCAGCTTAGCAGGCTGCCTTCGCAATCGGAGTTCTTCGTGATATCTAAGCATTTCACCGCTACACCACGAATTCCGCCCACTTTGTGCGTACTCAAGGAAACCAGTTCGCGCTGCAGTGCAGATGTTGAGCATCTACATTTCACAACACGCTTAATCTCCGGCCTACGCTCCCTTTAAACCCAATAAATCCGGATAACGCCCGGACCTTCCGTATTACCGCGGCTGCTGGCACGGAATT","Prevotella.15","Prevotella.3","Prevotella.15"
"Paraprevotella","Bacteria","Bacteroidetes","Bacteroidia","Bacteroidales","Prevotellaceae","Paraprevotella",NA,NA,NA,"Paraprevotella xylaniphila, Paraprevotella, Paraprevotella.1, Paraprevotella.2, Paraprevotella.3","Paraprevotella","Paraprevotella"
"Bacteroides","Bacteria","Bacteroidetes","Bacteroidia","Bacteroidales","Bacteroidaceae","Bacteroides",NA,NA,NA,"Bacteroides eggerthii, Bacteroides, Bacteroides dorei/stercoris, Bacteroides uniformis, Bacteroides uniformis.1, Bacteroides.1, Bacteroides cellulosilyticus/t et al., Bacteroides salyersiae, Bacteroides faecichinchillae/f et al., Bacteroides dorei/fragilis, Bacteroides finegoldii, Bacteroides ovatus/xylanisolvens, Bacteroides ovatus, Bacteroides ovatus.1, Bacteroides ovatus.2, Bacteroides massiliensis, Bacteroides dorei, Bacteroides dorei/vulgatus, Bacteroides.2, Bacteroides coprocola, Bacteroides vulgatus, Bacteroides vulgatus.1, Bacteroides.3, Bacteroides clarus, Bacteroides caccae","Bacteroides","Bacteroides dorei"
"Bacteroides plebeius","Bacteria","Bacteroidetes","Bacteroidia","Bacteroidales","Bacteroidaceae","Bacteroides","Bacteroides","plebeius",NA,"Bacteroides plebeius, Bacteroides plebeius.1","Bacteroides plebeius","Bacteroides plebeius.1"
"Actinobacteria","Bacteria","Actinobacteria","Actinobacteria",NA,NA,NA,NA,NA,NA,"Adlercreutzia celatus/equolifaciens, Coriobacteriaceae, Eggerthella lenta, Coriobacteriaceae.4, Actinobacteria","Actinobacteria","Coriobacteriaceae"
"Collinsella aerofaciens","Bacteria","Actinobacteria","Actinobacteria","Coriobacteriales","Coriobacteriaceae","Collinsella","Collinsella","aerofaciens","CCTGTTCGCTCCCCCAGCTTTCGCGCCTCAGCGTCGGTCTCGGCCCAGAGGGCCGCCTTCGCCACCGGTGTTCCACCCGATATCTGCGCATTCCACCGCTACACCGGGTGTTCCACCCTCCCCTACCGGACCCAAGCCGCGGAGGTTCCGGGGGCTTCGGGGGGTTGAGCCCCCCGCTTCGACCCCCGGCCTGCCGGGCCGCCTACGCGCGCTTTACGCCCAATGAATCCGGATAACGCTCGCCCCCTACGTATTACCGCGGCTGCTGGCACGTAGTT","Collinsella aerofaciens","Collinsella aerofaciens","Collinsella aerofaciens"
"Coriobacteriaceae","Bacteria","Actinobacteria","Actinobacteria","Coriobacteriales","Coriobacteriaceae",NA,NA,NA,NA,"Coriobacteriaceae.2, Atopobium vaginae, Coriobacteriaceae.3, Atopobium fossor/minutum, Atopobium deltae, Olsenella","Coriobacteriaceae","Atopobium vaginae"
"Coriobacteriaceae.1","Bacteria","Actinobacteria","Actinobacteria","Coriobacteriales","Coriobacteriaceae",NA,NA,NA,NA,"Coriobacteriaceae.1, Senegalimassilia anaerobia","Coriobacteriaceae.1","Senegalimassilia anaerobia"
"Bifidobacteriaceae","Bacteria","Actinobacteria","Actinobacteria","Bifidobacteriales","Bifidobacteriaceae",NA,NA,NA,NA,"Alloscardovia omnicolens, Bifidobacterium catenulatum/ga et al., Bifidobacterium breve/kashiwan et al., Bifidobacterium adolescentis/f et al., Bifidobacterium bifidum, Gardnerella vaginalis, Gardnerella vaginalis.1","Bifidobacteriaceae","Bifidobacterium catenulatum/ga et al."
"Actinomycetales","Bacteria","Actinobacteria","Actinobacteria","Actinomycetales",NA,NA,NA,NA,NA,"Corynebacterium imitans, Corynebacterium pseudogenitalium, Corynebacterium coyleae/mucifaciens, Corynebacterium sundsvallense/ et al., Corynebacterium amycolatum/lactis, Actinomycetales, Corynebacterium simulans/stria et al., Corynebacterium aurimucosum, Corynebacterium pseudogenitali et al.","Actinomycetales","Corynebacterium coyleae/mucifaciens"
"Actinomycetales.1","Bacteria","Actinobacteria","Actinobacteria","Actinomycetales",NA,NA,NA,NA,NA,"Arcanobacterium, Mobiluncus curtisii, Actinomyces neuii, Varibaculum cambriense, Varibaculum, Actinomyces europaeus, Actinomyces turicensis, Actinomyces odontolyticus, Arthrobacter albus/cumminsii","Actinomycetales.1","Mobiluncus curtisii"
"Firmicutes","Bacteria","Firmicutes",NA,NA,NA,NA,NA,NA,NA,"Clostridium_sensu_stricto cela et al., Clostridium_sensu_stricto, Clostridium_sensu_stricto.1, Firmicutes","Firmicutes","Clostridium_sensu_stricto"
"Clostridiales.1","Bacteria","Firmicutes","Clostridia","Clostridiales",NA,NA,NA,NA,NA,"Clostridiales, Clostridiales.1, Clostridiales.2","Clostridiales.1","Clostridiales.2"
"Clostridiales.2","Bacteria","Firmicutes","Clostridia","Clostridiales",NA,NA,NA,NA,"CCCGTTCGCTCCCCACGCTTTCGCGCCTCAGTGTCAGGTATAGTCCAGAAAGTCGCCTTCGCCACTGGTGTTCCTCCTAATATCTACGCATTTCACCGCTACACTAGGAATTCCACTTTCCTCTCCTACCCTCAAGACGTCCAGTTTCAAATGCAATCTCCAAGTTGAGCCCAGAGTTTTCACATCTGACTTAAATGTCCACCTACGCGCCCTTTACGCCCAGTAATTCCGGACAACGCTTGCTCCCTACGTATTACCGCGGCTGCTGGCACGTAGTT","Clostridiales.3","Clostridiales.2","Clostridiales.3"
"Peptococcus niger","Bacteria","Firmicutes","Clostridia","Clostridiales","Peptococcaceae_1","Peptococcus","Peptococcus","niger","CCTGTTTGCTCCCCACGCTTTCGCGCCTCAGCGTCAGTTATGGCCCAGTAAGTCGCCTTCGCCACTGGTGTTCCTCCTAATATCTACGCATTTCACCGCTACACTAGGAATTCCACTTACCTCTTCCATACTCAAGTCTGCCAGTATCAGATGCACGTTCAGGGTTGAGCCCTAACCTTTCACATCTGACTTAACAGACCGCCTGCGCGCCCTTTACGCCCAGTGATTCCGGACAACGCTTGCCCCCTATGTTTTACCGCGGCTGCTGGCACATAGTT","Peptococcus niger","Peptococcus niger","Peptococcus niger"
"Alphaproteobacteria","Bacteria","Proteobacteria","Alphaproteobacteria",NA,NA,NA,NA,NA,"CCTGTTTGATCCCCATGCTTTCGAGCCTCAGCGTCAATTTATAGCCAGATAGCCGCCTTCGCCACCGGTGTTCTACCCAATATCTACGAATTTCACCTCTACACTGGGTATTCCGCTATCCTCTCTATCATTCTAGTTACATAGTTATAACGGCAATTCCGAGGTTGAGCCCCGGCATTTCACCGCTATCTTACATAACCGCCTACACTCCCTTTACGCCCAGTAATTCCGAACAACGCTTGCCCCCTTCGTATTACCGCGGCTGCTGGCACGAAGTT","Alphaproteobacteria","Alphaproteobacteria","Alphaproteobacteria"
"Firmicutes.1","Bacteria","Firmicutes",NA,NA,NA,NA,NA,NA,NA,"Firmicutes.1, Firmicutes.2, Firmicutes.3, Firmicutes.4, Firmicutes.5","Firmicutes.1","Firmicutes.2"
"Veillonellaceae","Bacteria","Firmicutes","Negativicutes","Selenomonadales","Veillonellaceae",NA,NA,NA,NA,"Megasphaera, Negativicoccus, Negativicoccus succinicivorans, Dialister micraerophilus, Dialister, Dialister.1, Dialister propionicifaciens, Dialister pneumosintes, Dialister.2, Dialister invisus, Dialister.3, Allisonella histaminiformans, Dialister.4, Veillonellaceae, Veillonella atypica/dispar, Veillonella dispar/parvula, Veillonella parvula/rogosae/to et al., Megasphaera micronuciformis","Veillonellaceae","Dialister invisus"
"Acidaminococcaceae","Bacteria","Firmicutes","Negativicutes","Selenomonadales","Acidaminococcaceae",NA,NA,NA,NA,"Phascolarctobacterium, Phascolarctobacterium faecium, Succiniclasticum, Acidaminococcus intestinalis/i et al., Phascolarctobacterium.1, Phascolarctobacterium succinatutens","Acidaminococcaceae","Phascolarctobacterium succinatutens"
"Bacilli","Bacteria","Firmicutes","Bacilli",NA,NA,NA,NA,NA,NA,"Gemella asaccharolytica, Gemella haemolysans/morbilloru et al., Staphylococcus argenteus/arlet et al., Granulicatella adiacens/para-a et al., Granulicatella elegans, Enterococcus azikeevi/canintes et al., Facklamia, Eremococcus coleocola, Aerococcus christensenii, Facklamia ignava","Bacilli","Gemella haemolysans/morbilloru et al."
"Lactobacillus","Bacteria","Firmicutes","Bacilli","Lactobacillales","Lactobacillaceae","Lactobacillus","Lactobacillus",NA,NA,"Lactobacillus iners, Lactobacillus acidophilus/case et al.","Lactobacillus","Lactobacillus iners"
"Streptococcus","Bacteria","Firmicutes","Bacilli","Lactobacillales","Streptococcaceae","Streptococcus",NA,NA,NA,"Streptococcus agalactiae/dysga et al., Streptococcus, Streptococcus australis/dentis et al., Streptococcus australis/mitis/ et al., Streptococcus salivarius/vesti et al., Streptococcus anginosus/miller et al.","Streptococcus","Streptococcus"
"Holdemanella","Bacteria","Firmicutes","Erysipelotrichia","Erysipelotrichales","Erysipelotrichaceae","Holdemanella",NA,NA,NA,"Holdemanella, Holdemanella biformis","Holdemanella","Holdemanella biformis"
"Erysipelotrichaceae bacterium","Bacteria","Firmicutes","Erysipelotrichia","Erysipelotrichales","Erysipelotrichaceae",NA,"Erysipelotrichaceae","bacterium","CCTATTTGCTCCCCACGCTTTCGTGCCTCAGTGTCAGTTACAGACCAGGCGACCGCCTTCGCCACTGGTGTTCCTCCATATATCTACGCATTTTACCGCTACACATGGAATTCCATCGCCCTCTTCTGCACTCCAGCATACCAGTTTCCATAGCTTACAATGGTTGAGCCATTGCCTTTTACTACAGACTTAGTACGCCACCTACGCACCCTTTACGCCCAATGATTCCGGATAACGCTTGCCACCTACGTATTACCGCGGCTGCTGGCACGTAGTTA","Erysipelotrichaceae bacterium","Erysipelotrichaceae bacterium","Erysipelotrichaceae bacterium"
"Holdemania massiliensis","Bacteria","Firmicutes","Erysipelotrichia","Erysipelotrichales","Erysipelotrichaceae","Holdemania","Holdemania","massiliensis","CCTATTTGCTCCCCACGCTTTCGTGCATGAGCGTCAGTTACAGGCCAGGCAACCGCCTTCGCCACTGGTGTTCCTCCATATATCTACGCATTTTACCGCTACACATGGAATTCCATTGCCCTCTCCTGTACTCTAGTCTGACAGTTTCTAAGGCTGTATGGGGTTAAGCCCCACGCTTTCACCTTAAACTTTTCAAACCGCCTGCGCACCCTTTACGCCCAATAATTCCGGATAACGCTCGCCACCTACGTATTACCGCGGCTGCTGGCACGTAGTTA","Holdemania massiliensis","Holdemania massiliensis","Holdemania massiliensis"
"Erysipelotrichaceae","Bacteria","Firmicutes","Erysipelotrichia","Erysipelotrichales","Erysipelotrichaceae",NA,NA,NA,NA,"Coprobacillus cateniformis, Clostridium_XVIII ramosum, Clostridium_XVIII","Erysipelotrichaceae","Clostridium_XVIII ramosum"
"Fusobacterium","Bacteria","Fusobacteria","Fusobacteriia","Fusobacteriales","Fusobacteriaceae","Fusobacterium",NA,NA,NA,"Fusobacterium naviforme/nucleatum, Fusobacterium equinum, Fusobacterium, Fusobacterium.1, Fusobacterium nucleatum/period et al.","Fusobacterium","Fusobacterium nucleatum/period et al."
"Leptotrichiaceae","Bacteria","Fusobacteria","Fusobacteriia","Fusobacteriales","Leptotrichiaceae",NA,NA,NA,NA,"Sneathia, Leptotrichiaceae, Sneathia sanguinegens, Sneathia sanguinegens.1","Leptotrichiaceae","Sneathia sanguinegens"
"Firmicutes.2","Bacteria","Firmicutes",NA,NA,NA,NA,NA,NA,NA,"Clostridiales.4, Firmicutes.6","Firmicutes.2","Clostridiales.4"
"Clostridia","Bacteria","Firmicutes","Clostridia",NA,NA,NA,NA,NA,NA,"Murdochiella, Murdochiella.1, Clostridia","Clostridia","Murdochiella"
"Clostridiales_Incertae_Sedis_XI","Bacteria","Firmicutes","Clostridia","Clostridiales","Clostridiales_Incertae_Sedis_XI",NA,NA,NA,NA,"Clostridiales_Incertae_Sedis_XI, Finegoldia magna, Finegoldia, Parvimonas micra, Parvimonas","Clostridiales_Incertae_Sedis_XI","Parvimonas micra"
"Clostridiales.3","Bacteria","Firmicutes","Clostridia","Clostridiales",NA,NA,NA,NA,NA,"Clostridiales.5, Clostridiales.6","Clostridiales.3","Clostridiales.6"
"Ezakiella","Bacteria","Firmicutes","Clostridia","Clostridiales","Clostridiales_Incertae_Sedis_XI","Ezakiella",NA,NA,NA,"Ezakiella, Ezakiella peruensis","Ezakiella","Ezakiella"
"Anaerococcus","Bacteria","Firmicutes","Clostridia","Clostridiales","Clostridiales_Incertae_Sedis_XI","Anaerococcus",NA,NA,NA,"Anaerococcus provenciensis, Anaerococcus octavius, Anaerococcus, Anaerococcus prevotii/tetradius, Anaerococcus.1, Anaerococcus murdochii, Anaerococcus lactolyticus, Anaerococcus.2, Anaerococcus.3, Anaerococcus.4, Anaerococcus vaginalis, Anaerococcus senegalensis","Anaerococcus","Anaerococcus vaginalis"
"Clostridiales.4","Bacteria","Firmicutes","Clostridia","Clostridiales",NA,NA,NA,NA,NA,"Peptoniphilus coxii, Peptoniphilus, Peptoniphilus massiliensis, Peptoniphilus massiliensis.1, Clostridiales.7","Clostridiales.4","Peptoniphilus massiliensis.1"
"Peptoniphilus","Bacteria","Firmicutes","Clostridia","Clostridiales","Peptoniphilaceae","Peptoniphilus",NA,NA,NA,"Peptoniphilus duerdenii, Peptoniphilus.1, Peptoniphilus asaccharolyticus et al., Peptoniphilus gorbachii/harei/ et al., Peptoniphilus lacrimalis, Peptoniphilus.2","Peptoniphilus","Peptoniphilus asaccharolyticus et al."
"Peptoniphilus.1","Bacteria","Firmicutes","Clostridia","Clostridiales","Peptoniphilaceae","Peptoniphilus",NA,NA,"CCTGTTTGCTCCCCACGCTTTCGTTCCTCAGCGTCAGTTTGTGTCCAGCAAGTCGCCTTCGCCACCGGTATTCCTCCTAATATCTACGCATTTCACCGCTACACTAGGAATTCCACTTGCCTCTCCACTACTCAAGCTATGCAGTTTCTTGTGCTTACAAGGGTTGAGCCCTTGCCTTTCACACGAGACTTGCATTGCCGCCTGCGAACCCTTTACGCCCAGTGATTCCGGACAACGCTTGCTCCCTACGTATTACCGCGGCTGCTGGCACGTAGTTA","Peptoniphilus.3","Peptoniphilus.1","Peptoniphilus.3"
"Mogibacterium","Bacteria","Firmicutes","Clostridia","Clostridiales","Clostridiales_Incertae_Sedis_XIII","Mogibacterium",NA,NA,"CCTGTTTGCTACCCACACTTTCGTGCCTCAGTGTCAGTTGCTGTCCAGAAAGCCGCCTTCGCCGCCGGTGTTCCTCCTAATATCTACGCATTTCACCGCTACACTAGGAATTCCGCTTTCCCCTCCAGCACTCAAGTAACCCAGTTCGCATGGCAATTAACGGTTGAGCCGTTAGTTTAAACCTTGCGCTTAAATTACCACCTACGCACGCTTTACGCCCAATAATTCCGGATAACGCTTGCCCCCTACGTATTACCGCGGCTGCTGGCACGTAGTTA","Mogibacterium","Mogibacterium","Mogibacterium"
"Firmicutes.3","Bacteria","Firmicutes",NA,NA,NA,NA,NA,NA,NA,"Clostridiales.8, Clostridiales.9, Clostridiales.10, Clostridiales.11, Firmicutes.7, Clostridiales.12, Clostridiales.13, Clostridiales.14, Clostridiales.15, Clostridiales.16, Clostridiales_Incertae_Sedis_XIII","Firmicutes.3","Clostridiales.10"
"Peptostreptococcaceae","Bacteria","Firmicutes","Clostridia","Clostridiales","Peptostreptococcaceae",NA,NA,NA,NA,"Intestinibacter bartlettii, Peptostreptococcus anaerobius, Peptostreptococcus stomatis, Romboutsia","Peptostreptococcaceae","Peptostreptococcus anaerobius"
"Clostridiales.5","Bacteria","Firmicutes","Clostridia","Clostridiales",NA,NA,NA,NA,NA,"Clostridiales.17, Clostridiales.18, Clostridiales.19, Clostridiales.20","Clostridiales.5","Clostridiales.17"
"Fastidiosipila","Bacteria","Firmicutes","Clostridia","Clostridiales","Ruminococcaceae","Fastidiosipila",NA,NA,"CCTGTTTGCTCCCCACGCTTTCGCGCCTCAGCGTCAGTTAATAGCCAGAAAGCCGCCTTCGCCACTGGTGTTCCTCCTAATATCTACGCATTTTACCGCTACACTAGGAATTCCGCTTTCCCCTCTATCACTCAAGTACTGCAGTATCAGATGCACGCTCCCGGTTGAGCCGGGAGATTTCACATCTGACTTACAGTGCCGCCTACACGCCCTTTACACCCAGTAATTCCGGATAACGCTCGCCACCTACGTATTACCGCGGCTGCTGGCACGTAGTT","Fastidiosipila","Fastidiosipila","Fastidiosipila"
"Saccharofermentans","Bacteria","Firmicutes","Clostridia","Clostridiales","Ruminococcaceae","Saccharofermentans",NA,NA,"CCTGTTTGCTCCCCACGCTTTCGCGCCTCAGCGTCAGTTACTGTCCAGATAGCCGCCTTCGCCACCGGTGTTCCTCCTAATATCTACGCATTTTACCGCTACACTAGGAATTCCACTATCCTCTCCAGCACTCAAGCTAAACAGTTTGTAATGAACCCCAAGGTTAAGCCTTGGATTTAAACATCACACTTATCTAGCCGCCTACACGCCCTTTACGCCCAGTAAATCCGGATAACGCTCGCCACCTACGTATTACCGCGGCTGCTGGCACGTAGTTA","Saccharofermentans","Saccharofermentans","Saccharofermentans"
"Ruminococcaceae","Bacteria","Firmicutes","Clostridia","Clostridiales","Ruminococcaceae",NA,NA,NA,NA,"Ruminococcaceae, Ruminococcaceae.1, Ruminococcaceae.2, Ruminococcaceae.3, Ruminococcaceae.4, Ruminococcaceae.5, Ruminococcaceae.6, Ruminococcaceae.7, Intestinimonas butyriciproducens, Ruminococcaceae.8, Ruminococcaceae.9, Ruminococcaceae.10, Intestinimonas, Ruminococcaceae.11, Intestinimonas.1, Ruminococcaceae.12, Flavonifractor plautii, Flavonifractor, Pseudoflavonifractor","Ruminococcaceae","Flavonifractor plautii"
"Ruminococcaceae.1","Bacteria","Firmicutes","Clostridia","Clostridiales","Ruminococcaceae",NA,NA,NA,NA,"Ruminococcus, Ruminococcus callidus, Ruminococcus.1, Ruminococcus.2, Ruminococcus bicirculans, Clostridium_IV.5, Clostridium_IV.6","Ruminococcaceae.1","Ruminococcus bicirculans"
"Ruminococcaceae.2","Bacteria","Firmicutes","Clostridia","Clostridiales","Ruminococcaceae",NA,NA,NA,NA,"Ruminococcaceae.14, Ruminococcaceae.15, Ruminococcaceae.16, Ruminococcaceae.17, Ruminococcaceae.18, Anaerotruncus colihominis, Ruminococcaceae.19","Ruminococcaceae.2","Ruminococcaceae.15"
"Ruminococcaceae.3","Bacteria","Firmicutes","Clostridia","Clostridiales","Ruminococcaceae",NA,NA,NA,"CCTGTTTGCTCCCCACACTTTCGAGCCTCAGCGTCAGTAAAAGCCCAGTTGGCCGCCTTCGCCACTGGTGTTCCTCCTAATATCTACGCATTTCACCGCTACACTAGGAATTCCGCCAACCTCTACTTCACTCAAGACCTGCAGTTTCAAGCGCCGTTACCGGTTGAGCCGATATATTTCACGCCTGACTTGCCTGCCCGCCTACGCTCCCTTTACACCCAGTAATTCCGGACAACGCTTGCCACCTACGTATTACCGCGGCTGCTGGCACGTAGTTA","Ruminococcaceae.20","Ruminococcaceae.3","Ruminococcaceae.20"
"Ruminococcaceae.4","Bacteria","Firmicutes","Clostridia","Clostridiales","Ruminococcaceae",NA,NA,NA,NA,"Ruminococcaceae.21, Clostridium_IV, Clostridium_IV.1, Ruminococcaceae.22, Clostridium_IV.2, Ruminococcaceae.23, Ruminococcaceae.24, Clostridium_IV.3, Clostridium_IV leptum, Clostridium_IV.4, Ruminococcus bromii, Ruminococcaceae.25","Ruminococcaceae.4","Ruminococcus bromii"
