"","Kingdom","Phylum","Class","Order","Family","Genus","Genus.y","Species","Sequence","oldGroups","tag","oldname2"
"Clostridia","Bacteria","Firmicutes","Clostridia",NA,NA,NA,NA,NA,NA,"Clostridiales.3, Clostridiales.4, Clostridiales.5, Clostridia, Saccharofermentans, Fastidiosipila, Clostridium_sensu_stricto cela et al., Clostridium_sensu_stricto, Clostridium_sensu_stricto.1, Clostridiales.6, Peptococcus niger","Clostridia","Clostridium_sensu_stricto.1"
"Firmicutes","Bacteria","Firmicutes",NA,NA,NA,NA,NA,NA,NA,"Romboutsia, Intestinibacter bartlettii, Peptostreptococcus anaerobius, Peptostreptococcus stomatis, Clostridiales_Incertae_Sedis_XIII, Clostridiales.7, Clostridiales.8, Clostridiales.9, Clostridiales.10, Clostridiales.11, Clostridiales.12, Firmicutes, Clostridiales.13, Clostridiales.14, Mogibacterium, Clostridiales.15","Firmicutes","Peptostreptococcus anaerobius"
"Anaerococcus","Bacteria","Firmicutes","Clostridia","Clostridiales","Clostridiales_Incertae_Sedis_XI","Anaerococcus",NA,NA,NA,"Anaerococcus prevotii/tetradius, Anaerococcus, Anaerococcus murdochii, Anaerococcus.1, Anaerococcus lactolyticus, Anaerococcus provenciensis, Anaerococcus.2, Anaerococcus octavius, Anaerococcus.3, Anaerococcus senegalensis, Anaerococcus vaginalis, Anaerococcus.4","Anaerococcus","Anaerococcus vaginalis"
"Clostridia.1","Bacteria","Firmicutes","Clostridia",NA,NA,NA,NA,NA,NA,"Ezakiella, Ezakiella peruensis, Parvimonas, Parvimonas micra, Finegoldia, Finegoldia magna, Clostridiales_Incertae_Sedis_XI, Clostridia.1, Murdochiella, Murdochiella.1, Clostridiales.16, Clostridiales.17","Clostridia.1","Clostridiales.17"
"Clostridiales","Bacteria","Firmicutes","Clostridia","Clostridiales",NA,NA,NA,NA,NA,"Clostridiales.18, Peptoniphilus massiliensis, Peptoniphilus coxii, Peptoniphilus, Peptoniphilus massiliensis.1, Peptoniphilus.1, Peptoniphilus asaccharolyticus et al., Peptoniphilus gorbachii/harei/ et al., Peptoniphilus lacrimalis, Peptoniphilus.2, Peptoniphilus duerdenii, Peptoniphilaceae","Clostridiales","Peptoniphilus asaccharolyticus et al."
"Firmicutes.1","Bacteria","Firmicutes",NA,NA,NA,NA,NA,NA,NA,"Clostridiales.19, Firmicutes.1","Firmicutes.1","Clostridiales.19"
"Coriobacteriaceae","Bacteria","Actinobacteria","Actinobacteria","Coriobacteriales","Coriobacteriaceae",NA,NA,NA,NA,"Collinsella aerofaciens, Coriobacteriaceae, Coriobacteriaceae.1, Eggerthella lenta, Coriobacteriaceae.2, Coriobacteriaceae.3, Adlercreutzia celatus/equolifaciens, Senegalimassilia anaerobia, Atopobium vaginae, Coriobacteriaceae.4, Atopobium fossor/minutum, Atopobium deltae, Olsenella, Coriobacteriaceae.5","Coriobacteriaceae","Collinsella aerofaciens"
"Actinobacteria","Bacteria","Actinobacteria","Actinobacteria",NA,NA,NA,NA,NA,NA,"Arthrobacter albus/cumminsii, Alloscardovia omnicolens, Bifidobacterium bifidum, Bifidobacterium catenulatum/ga et al., Bifidobacterium breve/kashiwan et al., Bifidobacterium adolescentis/f et al., Gardnerella vaginalis, Gardnerella vaginalis.1, Corynebacterium aurimucosum, Corynebacterium pseudogenitali et al., Corynebacterium simulans/stria et al., Actinomycetales, Corynebacterium amycolatum/lactis, Corynebacterium imitans, Corynebacterium pseudogenitalium, Corynebacterium coyleae/mucifaciens, Corynebacterium sundsvallense/ et al., Arcanobacterium, Actinomyces neuii, Actinomyces turicensis, Actinomyces odontolyticus, Actinomyces europaeus, Varibaculum cambriense, Varibaculum, Mobiluncus curtisii","Actinobacteria","Bifidobacterium catenulatum/ga et al."
"Alphaproteobacteria","Bacteria","Proteobacteria","Alphaproteobacteria",NA,NA,NA,NA,NA,"CCTGTTTGATCCCCATGCTTTCGAGCCTCAGCGTCAATTTATAGCCAGATAGCCGCCTTCGCCACCGGTGTTCTACCCAATATCTACGAATTTCACCTCTACACTGGGTATTCCGCTATCCTCTCTATCATTCTAGTTACATAGTTATAACGGCAATTCCGAGGTTGAGCCCCGGCATTTCACCGCTATCTTACATAACCGCCTACACTCCCTTTACGCCCAGTAATTCCGAACAACGCTTGCCCCCTTCGTATTACCGCGGCTGCTGGCACGAAGTT","Alphaproteobacteria","Alphaproteobacteria","Alphaproteobacteria"
"Paraprevotella","Bacteria","Bacteroidetes","Bacteroidia","Bacteroidales","Prevotellaceae","Paraprevotella",NA,NA,NA,"Paraprevotella, Paraprevotella.1, Paraprevotella xylaniphila, Paraprevotella.2, Paraprevotella.3","Paraprevotella","Paraprevotella.2"
"Prevotella","Bacteria","Bacteroidetes","Bacteroidia","Bacteroidales","Prevotellaceae","Prevotella",NA,NA,"CCTGTTTGATACCCACACTTTCGAGCCTCAATGTCAGTTGCAGCTTAGCAGGCTGCCTTCGCAATCGGAGTTCTTCGTGATATCTAAGCATTTCACCGCTACACCACGAATTCCGCCCACTTTGTGCGTACTCAAGGAAACCAGTTCGCGCTGCAGTGCAGATGTTGAGCATCTACATTTCACAACACGCTTAATCTCCGGCCTACGCTCCCTTTAAACCCAATAAATCCGGATAACGCCCGGACCTTCCGTATTACCGCGGCTGCTGGCACGGAATT","Prevotella","Prevotella","Prevotella"
"Prevotella.1","Bacteria","Bacteroidetes","Bacteroidia","Bacteroidales","Prevotellaceae","Prevotella",NA,NA,NA,"Prevotella.1, Prevotella copri, Prevotella.2, Prevotella.3, Prevotella.4, Prevotella bergensis, Prevotella bergensis.1, Prevotella.5, Prevotella.6, Prevotella.7, Prevotella corporis, Prevotella corporis.1, Prevotella.8, Prevotella disiens, Prevotella.9, Prevotella bivia, Prevotella bivia.1, Prevotella buccalis, Prevotella.10, Prevotella buccalis.1, Prevotella.11, Prevotella.12, Prevotella timonensis, Prevotella.13, Prevotella.14, Prevotella.15","Prevotella.1","Prevotella disiens"
"Bacteroidetes","Bacteria","Bacteroidetes",NA,NA,NA,NA,NA,NA,"CCTGTTCGATACCCGCACCTTCGAGCCTCAACGTCAGTAGGGACGCGGCACGCTGCCTTCGCAATCGGGGTTCCTCGTGATATCTGAGCATTTCACCGCTACACCACGAATTCCGCGTGCCTCCAGCCCACTCAAGCCCGCCAGTTCGCGCAGCAGGGCCGCGGTTGGGCCGCGGCGTTTCACTGCACGCTTGACAGGCAGTCTGCGCTCCCTTTAAACCCAATAAATCCGGATAACACCCGGACCTTCCGTATTACCGCGGCTGCTGGCACGGAATT","Bacteroidetes","Bacteroidetes","Bacteroidetes"
"Bacteroides","Bacteria","Bacteroidetes","Bacteroidia","Bacteroidales","Bacteroidaceae","Bacteroides",NA,NA,NA,"Bacteroides cellulosilyticus/t et al., Bacteroides uniformis, Bacteroides uniformis.1, Bacteroides, Bacteroides ovatus, Bacteroides ovatus.1, Bacteroides ovatus.2, Bacteroides ovatus/xylanisolvens, Bacteroides finegoldii, Bacteroides dorei/fragilis, Bacteroides faecichinchillae/f et al., Bacteroides salyersiae, Bacteroides eggerthii, Bacteroides.1, Bacteroides massiliensis, Bacteroides plebeius, Bacteroides plebeius.1, Bacteroides coprocola, Bacteroides vulgatus, Bacteroides dorei, Bacteroides.2, Bacteroides dorei/vulgatus, Bacteroides vulgatus.1, Bacteroides dorei/stercoris, Bacteroides caccae, Bacteroides clarus, Bacteroides.3","Bacteroides","Bacteroides dorei"
"Porphyromonadaceae","Bacteria","Bacteroidetes","Bacteroidia","Bacteroidales","Porphyromonadaceae",NA,NA,NA,NA,"Porphyromonadaceae, Porphyromonas.6, Porphyromonas.7, Porphyromonas.8, Porphyromonas uenonis, Porphyromonas uenonis.1, Porphyromonas asaccharolytica","Porphyromonadaceae","Porphyromonas asaccharolytica"
"Porphyromonadaceae.1","Bacteria","Bacteroidetes","Bacteroidia","Bacteroidales","Porphyromonadaceae",NA,NA,NA,NA,"Porphyromonas, Porphyromonas.1, Porphyromonas.2, Porphyromonas bennonis, Porphyromonas.3, Porphyromonas.4, Porphyromonas.5, Porphyromonas somerae, Parabacteroides, Parabacteroides goldsteinii, Parabacteroides merdae, Parabacteroides distasonis, Parabacteroides.1, Parabacteroides distasonis.1, Parabacteroides distasonis.2, Parabacteroides distasonis.3","Porphyromonadaceae.1","Parabacteroides merdae"
"Porphyromonadaceae.2","Bacteria","Bacteroidetes","Bacteroidia","Bacteroidales","Porphyromonadaceae",NA,NA,NA,"CCTGTTCGATACCCGCGCTTTCGTGCCTCAGCGTCAATTACGGCCTCGTGGGATGCCTTCGCAATCGGTGTTCTGTGTGATATCTATGCATTTCACCGCTACACCACACATTCCTCCCACGTCGATCGTATTCCAGCCTCTCAGTTTCAACGGCACATCCCTCGTTGAGCGAGGGCATTTCACCGCTGACTTGAAATGCCGCCTACGCACCCTTTAAACCCAATAAATCCGGATAACGCTCGCATCCTCCGTATTACCGCGGCTGCTGGCACGGAGTT","Porphyromonadaceae.1","Porphyromonadaceae.2","Porphyromonadaceae.1"
"Bacteroidales","Bacteria","Bacteroidetes","Bacteroidia","Bacteroidales",NA,NA,NA,NA,NA,"Alistipes shahii, Alistipes finegoldii, Alistipes massiliensis, Alistipes finegoldii/onderdonkii, Alistipes putredinis, Alistipes obesi, Alistipes inops, Alistipes marseilloanorexicus, Alistipes, Alistipes indistinctus","Bacteroidales","Alistipes putredinis"
"Bacteroidetes.1","Bacteria","Bacteroidetes",NA,NA,NA,NA,NA,NA,"CCTGTTCGCTCCCCACGCTTTCGTGCCTCAGCGTCAATCCCGGCCTGGCCAGCTGCCTCCGCAATCGGCCTTCCACGTGATCTCTATGCATTTCACCGCTACACCACGCGTTCCGCCAGCCTCGACCGTATCCAAGCGGGGCGGTTTCCACGGCCAGGCCGGGGTTGAGCCCCGGCGTTTCACCGCGGACGGACCCCGCCGCCTGCGCACCCTTTAAACCCAGTAAATCCGGATAACGCTCGGATCCCCCGTATTACCGCGGCTGCTGGCACGGAGTT","Bacteroidetes.1","Bacteroidetes.1","Bacteroidetes.1"
"Porphyromonadaceae.3","Bacteria","Bacteroidetes","Bacteroidia","Bacteroidales","Porphyromonadaceae",NA,NA,NA,NA,"Odoribacter splanchnicus, Odoribacter splanchnicus.1, Butyricimonas paravirosa, Butyricimonas, Butyricimonas faecihominis, Butyricimonas.1, Butyricimonas.2, Butyricimonas.3","Porphyromonadaceae.3","Odoribacter splanchnicus"
"Porphyromonadaceae.4","Bacteria","Bacteroidetes","Bacteroidia","Bacteroidales","Porphyromonadaceae",NA,NA,NA,NA,"Porphyromonadaceae.2, Barnesiella, Barnesiella.1, Barnesiella.2, Barnesiella.3, Barnesiella.4, Porphyromonadaceae.3, Coprobacter fastidiosus, Coprobacter","Porphyromonadaceae.4","Barnesiella.3"
"Campylobacter","Bacteria","Proteobacteria","Epsilonproteobacteria","Campylobacterales","Campylobacteraceae","Campylobacter",NA,NA,NA,"Campylobacter hominis, Campylobacter ureolyticus, Campylobacter","Campylobacter","Campylobacter hominis"
"Desulfovibrionales","Bacteria","Proteobacteria","Deltaproteobacteria","Desulfovibrionales",NA,NA,NA,NA,NA,"Desulfovibrionales, Desulfovibrio, Bilophila, Bilophila.1, Bilophila wadsworthia","Desulfovibrionales","Bilophila wadsworthia"
"Gammaproteobacteria","Bacteria","Proteobacteria","Gammaproteobacteria",NA,NA,NA,NA,NA,NA,"Haemophilus parainfluenzae, Aggregatibacter segnis, Succinivibrio, Hafnia alvei, Pseudomonas deceptionensis/flu et al., Enterobacteriaceae, NA albertii/boydii/coli/coli,/ et al., Enterobacteriaceae.1","Gammaproteobacteria","NA albertii/boydii/coli/coli,/ et al."
"Betaproteobacteria","Bacteria","Proteobacteria","Betaproteobacteria",NA,NA,NA,NA,NA,NA,"Betaproteobacteria, Sutterella, Sutterella stercoricanis, Sutterella wadsworthensis, Sutterella.1, Sutterella wadsworthensis.1, Parasutterella excrementihominis","Betaproteobacteria","Sutterella wadsworthensis.1"
"Veillonellaceae","Bacteria","Firmicutes","Negativicutes","Selenomonadales","Veillonellaceae",NA,NA,NA,NA,"Megasphaera, Allisonella histaminiformans, Dialister pneumosintes, Dialister invisus, Dialister propionicifaciens, Dialister, Dialister.1, Dialister.2, Dialister.3, Dialister.4, Veillonellaceae, Dialister micraerophilus, Megasphaera micronuciformis, Veillonella atypica/dispar, Veillonella dispar/parvula, Veillonella parvula/rogosae/to et al., Negativicoccus succinicivorans, Negativicoccus","Veillonellaceae","Dialister invisus"
"Acidaminococcaceae","Bacteria","Firmicutes","Negativicutes","Selenomonadales","Acidaminococcaceae",NA,NA,NA,NA,"Phascolarctobacterium succinatutens, Phascolarctobacterium, Acidaminococcus intestinalis/i et al., Succiniclasticum, Phascolarctobacterium faecium, Phascolarctobacterium.1","Acidaminococcaceae","Phascolarctobacterium succinatutens"
"Erysipelotrichaceae","Bacteria","Firmicutes","Erysipelotrichia","Erysipelotrichales","Erysipelotrichaceae",NA,NA,NA,NA,"Coprobacillus cateniformis, Clostridium_XVIII ramosum, Erysipelotrichaceae","Erysipelotrichaceae","Clostridium_XVIII ramosum"
"Erysipelotrichaceae.1","Bacteria","Firmicutes","Erysipelotrichia","Erysipelotrichales","Erysipelotrichaceae",NA,NA,NA,NA,"Holdemanella, Holdemanella biformis, Erysipelotrichaceae bacterium","Erysipelotrichaceae.1","Erysipelotrichaceae bacterium"
"Holdemania massiliensis","Bacteria","Firmicutes","Erysipelotrichia","Erysipelotrichales","Erysipelotrichaceae","Holdemania","Holdemania","massiliensis","CCTATTTGCTCCCCACGCTTTCGTGCATGAGCGTCAGTTACAGGCCAGGCAACCGCCTTCGCCACTGGTGTTCCTCCATATATCTACGCATTTTACCGCTACACATGGAATTCCATTGCCCTCTCCTGTACTCTAGTCTGACAGTTTCTAAGGCTGTATGGGGTTAAGCCCCACGCTTTCACCTTAAACTTTTCAAACCGCCTGCGCACCCTTTACGCCCAATAATTCCGGATAACGCTCGCCACCTACGTATTACCGCGGCTGCTGGCACGTAGTTA","Holdemania massiliensis","Holdemania massiliensis","Holdemania massiliensis"
"Fusobacterium","Bacteria","Fusobacteria","Fusobacteriia","Fusobacteriales","Fusobacteriaceae","Fusobacterium",NA,NA,NA,"Fusobacterium naviforme/nucleatum, Fusobacterium, Fusobacterium nucleatum/period et al., Fusobacterium equinum, Fusobacterium.1","Fusobacterium","Fusobacterium nucleatum/period et al."
"Leptotrichiaceae","Bacteria","Fusobacteria","Fusobacteriia","Fusobacteriales","Leptotrichiaceae",NA,NA,NA,NA,"Leptotrichiaceae, Sneathia sanguinegens, Sneathia sanguinegens.1, Sneathia","Leptotrichiaceae","Sneathia sanguinegens"
"Bacilli","Bacteria","Firmicutes","Bacilli",NA,NA,NA,NA,NA,NA,"Gemella asaccharolytica, Gemella haemolysans/morbilloru et al., Staphylococcus argenteus/arlet et al., Granulicatella elegans, Granulicatella adiacens/para-a et al., Enterococcus azikeevi/canintes et al., Facklamia, Eremococcus coleocola, Streptococcus anginosus/miller et al., Streptococcus salivarius/vesti et al., Streptococcus australis/mitis/ et al., Streptococcus, Streptococcus australis/dentis et al., Streptococcus agalactiae/dysga et al., Lactobacillus iners, Lactobacillus acidophilus/case et al., Aerococcus christensenii, Facklamia ignava","Bacilli","Streptococcus"
"Firmicutes.2","Bacteria","Firmicutes",NA,NA,NA,NA,NA,NA,NA,"Firmicutes.2, Firmicutes.3, Firmicutes.4, Firmicutes.5, Firmicutes.6","Firmicutes.2","Firmicutes.2"
"Ruminococcaceae","Bacteria","Firmicutes","Clostridia","Clostridiales","Ruminococcaceae",NA,NA,NA,NA,"Ruminococcaceae.18, Ruminococcaceae.19, Faecalibacterium, Ruminococcaceae.20, Gemmiger, Gemmiger formicilis, Gemmiger.1, Ruminococcaceae.21, Faecalibacterium prausnitzii, Faecalibacterium.1, Faecalibacterium prausnitzii.1, Faecalibacterium prausnitzii.2, Faecalibacterium prausnitzii.3, Faecalibacterium prausnitzii.4, Faecalibacterium.2, Faecalibacterium.3, Faecalibacterium prausnitzii.5, Faecalibacterium.4, Faecalibacterium prausnitzii.6, Faecalibacterium.5","Ruminococcaceae","Faecalibacterium prausnitzii.5"
"Clostridiales.1","Bacteria","Firmicutes","Clostridia","Clostridiales",NA,NA,NA,NA,NA,"Lachnospiraceae, Clostridium_XlVa, Clostridium_XlVa aldenense, Clostridium_XlVa.1, Lachnospiraceae.1, Lachnospiraceae.2, Coprococcus, Lachnospiraceae.3, Lachnospiraceae.4, Lachnospiraceae.5, Clostridium_XlVb, Anaerostipes hadrus, Anaerostipes, Lachnospiraceae.6, Lachnospiraceae.7, Lachnospiraceae.8, Lachnospiraceae.9, Lachnospiraceae.10, Lachnospiraceae.11, Lachnospiraceae.12, Lachnospiraceae.13, Lachnospiraceae.14, Lachnospiraceae.15, Coprococcus catus, Clostridiales, Clostridium_XlVb.1, Clostridium_XlVb lactatifermentans, Clostridium_XlVb.2, Clostridiales.1, Clostridiales.2, Clostridium_XlVb.3, Lachnospiraceae.16, Lachnospiraceae.17, Lachnospiraceae.18, Lachnospiraceae.19, Lachnospiraceae.20, Lachnospiraceae.21, Lachnospiraceae.22, Lachnospiraceae.23, Roseburia, Roseburia faecis, Roseburia inulinivorans, Roseburia intestinalis, Roseburia hominis, Lachnospiraceae.24, Lachnospiraceae.25, Butyricicoccus, Ruminococcaceae, Ruminococcaceae.1, Butyricicoccus.1, Clostridiales.20, Clostridiales.21, Clostridiales.22, Clostridiales.23, Clostridium_IV, Clostridium_IV.1, Ruminococcaceae.2, Clostridiales.24, Ruminococcaceae.3, Ruminococcaceae.4, Ruminococcaceae.5, Ruminococcaceae.6, Ruminococcus, Ruminococcus bicirculans, Ruminococcus.1, Ruminococcus callidus, Ruminococcus.2, Ruminococcaceae.7, Anaerotruncus colihominis, Ruminococcaceae.8, Ruminococcaceae.9, Ruminococcaceae.10, Ruminococcaceae.11, Ruminococcaceae.12, Clostridium_IV.2, Ruminococcaceae.13, Ruminococcaceae.14, Clostridium_IV leptum, Ruminococcaceae.15, Clostridium_IV.3, Ruminococcaceae.16, Clostridium_IV.4, Ruminococcaceae.17, Clostridium_IV.5, Ruminococcus bromii, Ruminococcaceae.22, Ruminococcaceae.23, Ruminococcaceae.24, Ruminococcaceae.25, Ruminococcaceae.26, Clostridiales.25, Ruminococcaceae.27, Ruminococcaceae.28, Ruminococcaceae.29, Ruminococcaceae.30, Ruminococcaceae.31, Ruminococcaceae.32, Ruminococcaceae.33, Ruminococcaceae.34, Clostridiales.26, Ruminococcaceae.35, Ruminococcaceae.36, Oscillibacter, Oscillibacter.1, Oscillibacter.2, Oscillibacter.3, Ruminococcaceae.37, Oscillibacter.4, Oscillibacter.5, Oscillibacter.6, Ruminococcaceae.38, Ruminococcaceae.39, Ruminococcaceae.40, Ruminococcaceae.41, Oscillibacter.7, Oscillibacter.8, Ruminococcaceae.42, Intestinimonas, Ruminococcaceae.43, Ruminococcaceae.44, Ruminococcaceae.45, Intestinimonas.1, Intestinimonas.2, Ruminococcaceae.46, Intestinimonas butyriciproducens, Ruminococcaceae.47, Ruminococcaceae.48, Flavonifractor plautii, Flavonifractor, Pseudoflavonifractor, Ruminococcaceae.49, Ruminococcaceae.50, Ruminococcaceae.51, Ruminococcaceae.52, Ruminococcaceae.53, Ruminococcaceae.54, Ruminococcaceae.55, Clostridiales.27, Clostridiales.28, Clostridium_XlVa scindens, Dorea, Dorea longicatena, Lachnospiraceae.26, Eisenbergiella tayi, Lachnospiraceae.27, Lachnospiraceae.28, Lachnospiraceae.29, Howardella ureilytica, Howardella, Lachnospiraceae.30, Lachnospiraceae.31, Lachnospiraceae.32, Lachnospiraceae.33, Lachnospiraceae.34, Lachnospiraceae.35, Lachnospiraceae.36, Lachnospiraceae.37, Lachnospiraceae.38, Ruminococcus2, Ruminococcus2.1, Lachnospiraceae.39, Ruminococcus2.2, Lachnospiraceae.40, Ruminococcus2.3, Blautia faecis, Blautia, Blautia.1, Blautia.2, Blautia.3, Blautia hansenii/producta, Blautia.4, Blautia obeum, Blautia obeum/wexlerae, Blautia.5, Blautia obeum.1, Blautia.6, Lachnospiraceae.41, Lachnospiraceae.42, Blautia.7, Blautia.8, Lachnospiraceae.43, Lachnospiraceae.44, Lachnospiraceae.45, Lachnospiraceae.46, Lachnospiraceae.47, Lachnospiraceae.48, Lachnospiraceae.49, Fusicatenibacter saccharivorans, Dorea formicigenerans, Clostridium_XlVa symbiosum, Clostridium_XlVa.2, Coprococcus comes, Clostridium_XlVa.3, Clostridium glycyrrhizinilyticum, Lachnospiraceae.50, Lachnospiraceae.51, Clostridium_XlVa bolteae/clost et al., Lachnospiraceae.52, Lachnospiraceae.53, Lachnospiraceae.54, Lachnospiraceae.55, Hungatella effluvii/hathewayi, Clostridium_XlVa.4, Lachnospiraceae.56, Lachnospiraceae.57, Clostridium_XlVa asparagiforme et al., Lachnospiraceae.58, Lachnospiraceae.59, Lachnospiraceae.60, Clostridium_XlVa.5, Clostridium_XlVa.6, Lachnospiraceae.61, Lachnospiraceae.62","Clostridiales.1","Blautia obeum/wexlerae"
